{
  "version": "1.0.0",
  "created_at": "2026-08-07T06:07:16.473441Z",
  "cases": [
    {
      "id": "case_001",
      "input": "Hi there, I noticed I was charged twice for my subscription this month. Can I get a refund for the extra charge please? My account email is sarah.connor@email.com.",
      "expected_category": "billing",
      "expected_summary_keywords": [
        "double charge",
        "refund",
        "subscription"
      ],
      "difficulty": "easy",
      "tags": [],
      "notes": "A straightforward and clear duplicate charge complaint with all necessary account info provided.",
      "adversarial_target": null
    },
    {
      "id": "case_002",
      "input": "Hello, I need to update the credit card on file for my monthly plan. The old card expired and my last payment failed. How do I change this?",
      "expected_category": "billing",
      "expected_summary_keywords": [
        "credit card",
        "update",
        "failed payment"
      ],
      "difficulty": "easy",
      "tags": [],
      "notes": "Clear payment method update request directly related to billing maintenance.",
      "adversarial_target": null
    },
    {
      "id": "case_003",
      "input": "Hey, I just wanted to download my invoices for Q3 and Q4 of last year for my taxes, but I cant find where to download them in my dashboard. Could you send them over?",
      "expected_category": "billing",
      "expected_summary_keywords": [
        "invoices",
        "download",
        "taxes"
      ],
      "difficulty": "easy",
      "tags": [
        "typo"
      ],
      "notes": "Simple invoice request containing a minor typo ('cant') while remaining unambiguously about billing records.",
      "adversarial_target": null
    },
    {
      "id": "case_004",
      "input": "Good morning. I would like to cancel my annual membership before it auto renews next week. Please confirm cancellation and let me know if I am due any prorated refund.",
      "expected_category": "billing",
      "expected_summary_keywords": [
        "cancel",
        "auto renew",
        "refund"
      ],
      "difficulty": "easy",
      "tags": [],
      "notes": "Direct cancellation and refund inquiry tied to upcoming subscription renewal.",
      "adversarial_target": null
    },
    {
      "id": "case_005",
      "input": "Hi team, my payment went through yesterday but my account still says past due. Can you please check why my balance hasn't updated yet?",
      "expected_category": "billing",
      "expected_summary_keywords": [
        "payment",
        "past due",
        "balance"
      ],
      "difficulty": "easy",
      "tags": [],
      "notes": "Clear payment processing and account balance update inquiry.",
      "adversarial_target": null
    },
    {
      "id": "case_006",
      "input": "Hey team, I just noticed that my latest invoice #98234 shows a charge for the Pro tier, but I downgraded to Basic three weeks ago. Can you look into this and apply the difference as a credit to my account? Thanks.",
      "expected_category": "billing",
      "expected_summary_keywords": [
        "invoice",
        "downgrade",
        "overcharge",
        "credit"
      ],
      "difficulty": "medium",
      "tags": [
        "ambiguous"
      ],
      "notes": "Tests the classifier's ability to distinguish a billing dispute from a general account settings request.",
      "adversarial_target": null
    },
    {
      "id": "case_007",
      "input": "Good afternoon, my company card was renewed last week and I need to update our billing details in the portal, but every time I try to save the new expiration date, the page throws an error 500. We have an upcoming renewal due tomorrow so I want to avoid any service interruption.",
      "expected_category": "billing",
      "expected_summary_keywords": [
        "credit card",
        "update",
        "error",
        "renewal"
      ],
      "difficulty": "medium",
      "tags": [
        "multi-issue",
        "emotional"
      ],
      "notes": "Combines technical error messaging with a fundamental billing profile update task.",
      "adversarial_target": null
    },
    {
      "id": "case_008",
      "input": "Hi support, I am a bit confused about my last bill. It looks like I was charged twice for the same add-on module. Also, I never received the PDF receipt in my email inbox like usual. Could someone check the ledger for me?",
      "expected_category": "billing",
      "expected_summary_keywords": [
        "double charge",
        "add-on",
        "receipt",
        "ledger"
      ],
      "difficulty": "medium",
      "tags": [
        "multi-issue",
        "typo"
      ],
      "notes": "Includes both a financial discrepancy and a document request, testing multi-issue parsing under billing.",
      "adversarial_target": null
    },
    {
      "id": "case_009",
      "input": "Hello, I cancelled my subscription back in November, yet I just saw a pending charge from your company on my bank statement this morning. This is unacceptable and needs to be refunded immediately.",
      "expected_category": "billing",
      "expected_summary_keywords": [
        "cancelled",
        "pending charge",
        "refund",
        "subscription"
      ],
      "difficulty": "medium",
      "tags": [
        "emotional"
      ],
      "notes": "Evaluates handling of angry customer emails regarding post-cancellation charges.",
      "adversarial_target": null
    },
    {
      "id": "case_010",
      "input": "To whom it may concern, our accounting department requires a detailed breakdown of taxes and VAT for all invoices paid throughout the last fiscal year. Can you generate a consolidated statement for us?",
      "expected_category": "billing",
      "expected_summary_keywords": [
        "VAT",
        "taxes",
        "invoices",
        "statement"
      ],
      "difficulty": "medium",
      "tags": [
        "ambiguous"
      ],
      "notes": "Assesses formal requests for historical financial documents rather than direct payment issues.",
      "adversarial_target": null
    },
    {
      "id": "case_011",
      "input": "Hey team, I just noticed that the tier upgrade I requested last Tuesday seems to have triggered a double charge on my corporate card statement ending in 4092. More importantly though, why is my dashboard still showing the legacy feature set even though the payment went through immediately? I need this sorted before our sprint review tomorrow morning.",
      "expected_category": "billing",
      "expected_summary_keywords": [
        "double charge",
        "tier upgrade",
        "corporate card"
      ],
      "difficulty": "hard",
      "tags": [
        "ambiguous",
        "multi-issue",
        "emotional"
      ],
      "notes": "Tests the classifier's ability to prioritize billing when technical and account issues are equally prominent.",
      "adversarial_target": null
    },
    {
      "id": "case_012",
      "input": "To Whom It May Concern, regarding invoice #99214 issued on the 4th, our accounting department cannot reconcile the professional services line item with our initial contract quote. We have withheld payment pending clarification, which unfortunately caused our automated system access to be suspended this morning. Please adjust the ledger so we can settle the correct balance.",
      "expected_category": "billing",
      "expected_summary_keywords": [
        "invoice",
        "contract quote",
        "account suspension"
      ],
      "difficulty": "hard",
      "tags": [
        "ambiguous",
        "multi-issue"
      ],
      "notes": "Blends account access and contract disputes into what is fundamentally an invoice correction request.",
      "adversarial_target": null
    },
    {
      "id": "case_013",
      "input": "So thrilled to see an extra fifty bucks taken out of my account this month when I explicitly downgraded my plan during the renewal window. Is this your way of saying goodbye to loyal customers? Fix it.",
      "expected_category": "billing",
      "expected_summary_keywords": [
        "extra charge",
        "downgrade",
        "renewal"
      ],
      "difficulty": "hard",
      "tags": [
        "sarcastic",
        "emotional"
      ],
      "notes": "The sarcastic tone and anger might lead a simple classifier to flag this as general churn or emotional complaint rather than billing.",
      "adversarial_target": null
    },
    {
      "id": "case_014",
      "input": "Hello support, my bank statement shows a pending transaction from your company for $450, but my internal project budget only allocated $300 for this software license. Can you tell me exactly what this extra fee covers so I can update my expense report before submitting it to finance?",
      "expected_category": "billing",
      "expected_summary_keywords": [
        "pending transaction",
        "expense report",
        "extra fee"
      ],
      "difficulty": "hard",
      "tags": [
        "ambiguous",
        "vague"
      ],
      "notes": "Frames the issue around expense reporting and budgeting, making the core billing inquiry less direct.",
      "adversarial_target": null
    },
    {
      "id": "case_015",
      "input": "Hi there, I accidentaly paid for the annual subscrption instead of monthly because the button layout was confusing on mobile. Can you reverse the charge and switch me to the monthly plan instead? Thanks, Marcus.",
      "expected_category": "billing",
      "expected_summary_keywords": [
        "annual subscription",
        "reverse charge",
        "monthly plan"
      ],
      "difficulty": "hard",
      "tags": [
        "typo",
        "ambiguous"
      ],
      "notes": "Combines a UI/UX complaint with a direct request for a financial refund and subscription adjustment.",
      "adversarial_target": null
    },
    {
      "id": "case_016",